{
  "schema": "source-freeze-gates/1",
  "repositories": [
    {"id": "agent-utilities", "kind": "repository"},
    {"id": "epistemic-graph", "kind": "repository"},
    {"id": "langfuse-agent", "kind": "repository"},
    {"id": "provider-fleet", "kind": "fleet"}
  ],
  "commands": [
    {
      "id": "eg-mutation-contract",
      "repository": "epistemic-graph",
      "argv": ["{python}", "scripts/check_persisted_mutation_contract.py"],
      "timeout_seconds": 120,
      "covers": ["G-02", "G-11"]
    },
    {
      "id": "au-public-boundary",
      "repository": "agent-utilities",
      "argv": ["{python}", "scripts/check_public_graph_boundary.py", "{repo:agent-utilities}"],
      "timeout_seconds": 120,
      "covers": ["G-03", "G-07"]
    },
    {
      "id": "eg-read-policy",
      "repository": "epistemic-graph",
      "argv": ["{python}", "scripts/check_universal_read_rls.py"],
      "timeout_seconds": 120,
      "covers": ["G-01", "G-04"]
    },
    {
      "id": "eg-lazy-lifecycle",
      "repository": "epistemic-graph",
      "argv": ["{python}", "scripts/check_lazy_lifecycle_architecture.py"],
      "timeout_seconds": 120,
      "covers": ["G-05"]
    },
    {
      "id": "au-connector-manifests",
      "repository": "agent-utilities",
      "argv": [
        "{python}",
        "scripts/check_connector_manifests.py",
        "--agents-root",
        "{repo:provider-fleet}/agents"
      ],
      "timeout_seconds": 120,
      "covers": ["G-06", "G-19"]
    },
    {
      "id": "au-connector-bundles",
      "repository": "agent-utilities",
      "argv": [
        "{python}",
        "scripts/check_connector_capability_bundles.py",
        "--agents-root",
        "{repo:provider-fleet}/agents",
        "--bundled-root",
        "{repo:agent-utilities}/agent_utilities/knowledge_graph/ontology/connector_manifests",
        "--lock-path",
        "{repo:agent-utilities}/agent_utilities/knowledge_graph/ontology.lock",
        "--workspace",
        "{repo:provider-fleet}/agents/repository-manager/repository_manager/workspace.yml"
      ],
      "timeout_seconds": 300,
      "covers": ["G-06", "G-19"]
    },
    {
      "id": "au-ontology-library",
      "repository": "agent-utilities",
      "argv": [
        "{python}",
        "scripts/check_ontology.py",
        "--provider-root",
        "{repo:provider-fleet}/agents"
      ],
      "timeout_seconds": 300,
      "covers": ["G-06", "G-13", "G-33"]
    },
    {
      "id": "au-current-only",
      "repository": "agent-utilities",
      "argv": ["{python}", "scripts/check_current_only_contract.py"],
      "timeout_seconds": 180,
      "covers": ["G-07", "G-12", "G-35", "G-36"]
    },
    {
      "id": "au-work-item-boundary",
      "repository": "agent-utilities",
      "argv": ["{python}", "scripts/check_native_work_item_boundary.py", "{repo:agent-utilities}"],
      "timeout_seconds": 120,
      "covers": ["G-08", "G-09", "G-16"]
    },
    {
      "id": "au-change-envelope-boundary",
      "repository": "agent-utilities",
      "argv": ["{python}", "scripts/check_native_change_envelope_boundary.py"],
      "timeout_seconds": 120,
      "covers": ["G-11", "G-13"]
    },
    {
      "id": "eg-modality-architecture",
      "repository": "epistemic-graph",
      "argv": ["{python}", "scripts/check_p2_modality_architecture.py"],
      "timeout_seconds": 120,
      "covers": ["G-14", "G-15"]
    },
    {
      "id": "eg-analytics-reasoning",
      "repository": "epistemic-graph",
      "argv": ["{python}", "scripts/check_p2_analytics_reasoning_architecture.py"],
      "timeout_seconds": 120,
      "covers": ["G-15", "G-16", "G-17"]
    },
    {
      "id": "au-context-compiler",
      "repository": "agent-utilities",
      "argv": ["{python}", "scripts/check_context_compiler_boundary.py"],
      "timeout_seconds": 120,
      "covers": ["G-18"]
    },
    {
      "id": "au-provider-fleet",
      "repository": "agent-utilities",
      "argv": [
        "{python}",
        "scripts/check_provider_fleet_contract.py",
        "--workspace",
        "{repo:provider-fleet}/agents/repository-manager/repository_manager/workspace.yml",
        "--providers-root",
        "{repo:provider-fleet}/agents"
      ],
      "timeout_seconds": 300,
      "covers": ["G-19", "G-22", "G-33", "G-38"]
    },
    {
      "id": "au-production-assets",
      "repository": "agent-utilities",
      "argv": [
        "{python}",
        "scripts/deployment/check_production_assets.py",
        "--repository-root",
        "{repo:agent-utilities}"
      ],
      "timeout_seconds": 180,
      "covers": ["G-20", "G-21"]
    },
    {
      "id": "au-version-consistency",
      "repository": "agent-utilities",
      "argv": ["{python}", "scripts/check_version_consistency.py"],
      "timeout_seconds": 120,
      "covers": ["G-22", "G-31"]
    },
    {
      "id": "au-release-source-contract",
      "repository": "agent-utilities",
      "argv": [
        "{python}",
        "scripts/release/check_release_catalogs.py"
      ],
      "timeout_seconds": 120,
      "covers": ["G-22", "G-31", "G-38"]
    },
    {
      "id": "au-oci-layout-export-contract",
      "repository": "agent-utilities",
      "argv": [
        "{python}",
        "scripts/release/check_oci_layout_export.py"
      ],
      "timeout_seconds": 120,
      "covers": ["G-22", "G-38"]
    },
    {
      "id": "au-fleet-supply-chain",
      "repository": "agent-utilities",
      "argv": [
        "{python}",
        "scripts/check_fleet_supply_chain.py",
        "--source-snapshot-root",
        "{repo:provider-fleet}/agents",
        "--snapshot-workspace",
        "{repo:provider-fleet}/agents/repository-manager/repository_manager/workspace.yml"
      ],
      "timeout_seconds": 300,
      "covers": ["G-22", "G-38"]
    },
    {
      "id": "au-dependency-inventory",
      "repository": "agent-utilities",
      "argv": [
        "{python}",
        "scripts/audit_fleet_dependencies.py",
        "{repo:agent-utilities}",
        "--inventory-only",
        "--single-source-snapshot"
      ],
      "timeout_seconds": 300,
      "covers": ["G-22", "G-38"]
    },
    {
      "id": "eg-dependency-inventory",
      "repository": "agent-utilities",
      "argv": [
        "{python}",
        "scripts/audit_fleet_dependencies.py",
        "{repo:epistemic-graph}",
        "--inventory-only",
        "--single-source-snapshot"
      ],
      "timeout_seconds": 300,
      "covers": ["G-22", "G-38"]
    },
    {
      "id": "fleet-dependency-inventory",
      "repository": "agent-utilities",
      "argv": [
        "{python}",
        "scripts/audit_fleet_dependencies.py",
        "--inventory-only",
        "--source-snapshot-root",
        "{repo:provider-fleet}/agents",
        "--snapshot-workspace",
        "{repo:provider-fleet}/agents/repository-manager/repository_manager/workspace.yml"
      ],
      "timeout_seconds": 600,
      "covers": ["G-22", "G-38"]
    },
    {
      "id": "eg-operations-protocol",
      "repository": "epistemic-graph",
      "argv": ["{python}", "scripts/check_epistemic_operations_protocol.py"],
      "timeout_seconds": 120,
      "covers": ["G-25"]
    },
    {
      "id": "au-exact-harness-contract",
      "repository": "agent-utilities",
      "argv": ["{python}", "scripts/check_exact_local_gates_harness.py"],
      "timeout_seconds": 180,
      "covers": ["G-26", "G-30", "G-32", "G-34", "G-35", "G-37"]
    },
    {
      "id": "au-exact-closure-layer",
      "repository": "agent-utilities",
      "argv": ["{python}", "scripts/check_exact_artifact_closure.py"],
      "timeout_seconds": 120,
      "covers": ["G-02", "G-05", "G-14", "G-22", "G-26", "G-30", "G-32", "G-34", "G-37"]
    },
    {
      "id": "au-prebundled-skills",
      "repository": "agent-utilities",
      "argv": ["{python}", "scripts/check_prebundled_skills.py"],
      "timeout_seconds": 120,
      "covers": ["G-27", "G-33"]
    },
    {
      "id": "au-skill-collisions",
      "repository": "agent-utilities",
      "argv": [
        "{python}",
        "scripts/check_skill_name_collision.py",
        "--root",
        "{repo:provider-fleet}",
        "--strict"
      ],
      "timeout_seconds": 120,
      "covers": ["G-27"]
    },
    {
      "id": "au-skill-certification",
      "repository": "agent-utilities",
      "argv": ["{python}", "scripts/check_skill_validation_certification.py"],
      "timeout_seconds": 120,
      "covers": ["G-22", "G-27", "G-30", "G-38"]
    },
    {
      "id": "au-external-graph",
      "repository": "agent-utilities",
      "argv": ["{python}", "scripts/check_external_graph_contract.py"],
      "timeout_seconds": 120,
      "covers": ["G-28"]
    },
    {
      "id": "au-fleet-tls",
      "repository": "agent-utilities",
      "argv": [
        "{python}",
        "scripts/check_fleet_tls_policy.py",
        "--agents-root",
        "{repo:provider-fleet}/agents",
        "--require-fleet"
      ],
      "timeout_seconds": 300,
      "covers": ["G-29", "G-38"]
    },
    {
      "id": "au-http-egress",
      "repository": "agent-utilities",
      "argv": ["{python}", "scripts/check_http_egress_boundary.py"],
      "timeout_seconds": 120,
      "covers": ["G-28", "G-29", "G-38"]
    },
    {
      "id": "au-security-contract",
      "repository": "agent-utilities",
      "argv": [
        "{python}",
        "scripts/security_contract.py",
        "--contract",
        ".security/security-contract.json",
        "validate"
      ],
      "timeout_seconds": 120,
      "covers": ["G-38"]
    },
    {
      "id": "eg-security-contract",
      "repository": "epistemic-graph",
      "argv": [
        "{python}",
        "scripts/security_contract.py",
        "--contract",
        ".security/security-contract.json",
        "validate"
      ],
      "timeout_seconds": 120,
      "covers": ["G-38"]
    },
    {
      "id": "lf-security-contract",
      "repository": "langfuse-agent",
      "argv": [